{
  "accepted_case_count": 2,
  "artifact_policy": "metadata_only_source_omitted",
  "blocked_execution_surfaces": [
    "backend_artifact_execution",
    "bytecode_compilation",
    "decorator_evaluation",
    "device_access",
    "dynamic_library_loading",
    "environment_dependent_behavior",
    "file_system_access",
    "frontend_module_import",
    "generated_artifact_execution",
    "network_access",
    "plugin_discovery",
    "python_function_inspection",
    "subprocess_execution",
    "triton_jit_execution"
  ],
  "bridge_contract": "source_to_intent_research_preflight_bridge.execution_free.v0",
  "case_count": 7,
  "cases": [
    {
      "bridge_stage": "accepted_pipeline",
      "case_id": "accepted_matmul_elementwise",
      "expectation": "accepted",
      "operation_families": [
        "elementwise",
        "matmul"
      ],
      "parser_diagnostic_outcome": "accepted",
      "parser_rejection_reason": "",
      "preflight_rejected_features": [],
      "preflight_status": "accepted",
      "source_digest": "sha256:ad113b078fe24fcd871fbfb3f95b03e6192dbad3e607bbb737a9e09aa92f9bad",
      "source_name": "research_matmul_elementwise"
    },
    {
      "bridge_stage": "accepted_pipeline",
      "case_id": "accepted_softmax_reduction",
      "expectation": "accepted",
      "operation_families": [
        "reduction",
        "softmax"
      ],
      "parser_diagnostic_outcome": "accepted",
      "parser_rejection_reason": "",
      "preflight_rejected_features": [],
      "preflight_status": "accepted",
      "source_digest": "sha256:4256aa2ead107dfd1fe3b5cad55224c19c52aaad4aa23fc3590bdc5cc641d230",
      "source_name": "research_softmax_reduction"
    },
    {
      "bridge_stage": "parser_semantic_reject",
      "case_id": "reject_ambiguous_softmax_axis",
      "expectation": "rejected",
      "operation_families": [
        "softmax"
      ],
      "parser_diagnostic_outcome": "rejected",
      "parser_rejection_reason": "missing_axis_keyword",
      "preflight_rejected_features": [],
      "preflight_status": "accepted",
      "source_digest": "sha256:d18b671c9e2d4924d7df7af20aa575c40773d839d4ce708d7d7c5b9e95100803",
      "source_name": "reject_ambiguous_softmax_axis"
    },
    {
      "bridge_stage": "preflight_reject",
      "case_id": "reject_annotated_signature",
      "expectation": "rejected",
      "operation_families": [],
      "parser_diagnostic_outcome": "rejected",
      "parser_rejection_reason": "preflight_annotation",
      "preflight_rejected_features": [
        "annotation"
      ],
      "preflight_status": "rejected",
      "source_digest": "sha256:bef767e7a70a31a52c6e38a7fed87af653d5e9693fbaf9080b3ffc3d4ba29d58",
      "source_name": "reject_annotated_signature"
    },
    {
      "bridge_stage": "preflight_reject",
      "case_id": "reject_decorator_call",
      "expectation": "rejected",
      "operation_families": [],
      "parser_diagnostic_outcome": "rejected",
      "parser_rejection_reason": "preflight_decorator_call",
      "preflight_rejected_features": [
        "decorator_call",
        "unsupported_call_target"
      ],
      "preflight_status": "rejected",
      "source_digest": "sha256:3163e3195ebe39e4b6d2e3919772b538f767b6aa3a0ac5effbad3e185b94be33",
      "source_name": "reject_decorator_call"
    },
    {
      "bridge_stage": "parser_semantic_reject",
      "case_id": "reject_hardware_hint",
      "expectation": "rejected",
      "operation_families": [],
      "parser_diagnostic_outcome": "rejected",
      "parser_rejection_reason": "unsupported_assignment_value",
      "preflight_rejected_features": [],
      "preflight_status": "accepted",
      "source_digest": "sha256:41e026079ce8ccc08c2b7ad7f2151808bd0309c2a0ea4a226f8dfa94cec85759",
      "source_name": "reject_hardware_hint"
    },
    {
      "bridge_stage": "preflight_reject",
      "case_id": "reject_import_escape",
      "expectation": "rejected",
      "operation_families": [],
      "parser_diagnostic_outcome": "rejected",
      "parser_rejection_reason": "preflight_import_statement",
      "preflight_rejected_features": [
        "import_statement"
      ],
      "preflight_status": "rejected",
      "source_digest": "sha256:398e59a873b62440e63c169d5504e5a17b4dc94d46285eb653c3c01d03c67647",
      "source_name": "reject_import_escape"
    }
  ],
  "default_parser_status": "default_parser_blocked",
  "diagnostics_contract": "source_to_intent_research_diagnostics.execution_free.v0",
  "diagnostics_digest": "sha256:672cecfb0a7e64675ca0b06234aec9a9ff0f40bbff5b8116811d295714208ef5",
  "parser_output_policy": "source_intent.v0_plain_data_only",
  "parser_semantic_reject_count": 2,
  "parser_status": "research_explicit_only",
  "preflight_accepted_count": 4,
  "preflight_contract": "triton_source_preflight.execution_free.v0",
  "preflight_reject_count": 3,
  "raw_source_policy": "omitted_by_policy",
  "rejected_case_count": 5,
  "schema_version": "tuc.source_to_intent_research_preflight_bridge_report.v0",
  "source_boundary": "triton_source_preflight_before_research_parser",
  "status": "PASS"
}
